New Jersey,0,34,NJ PL 1999 Ch. 23,Renewables Portfolio Standard,3/1/1999,6.50%,2012,,,0%,,0,1,each electric power supplier or basic generation service provider,"BTM, Community Choice Aggregator, Co-Op, IOU, Municipal, Political Subdivision, Retail Power Marketer, State",Federal,0.00%,2020,2000,52,TRUE,#N/A,#N/A,FALSE,START RESULTS DO NOT DELETE,#N/A,#N/A,#N/A,#N/A,#N/A,#N/A,#N/A,#N/A,#N/A,#N/A,END RESULTS DO NOT DELETE,0.00%,7%,0.00%,0.00%,0.00%,0.00%,0.00%,7%,0%,7%,100.0%,0%,0.00%,0.00%,0.00%,0.00%,0.00%,0%,#N/A,#N/A,0.00%,CES,4.00%,2012,0,0,0,4.00%,100%,0.00%,1.00,0.00%,0.00%,0.00%,0.00%,0.00%,0.00%,0.00%,4.00%,0.00%,CES,2.50%,2012,0,1,1,0.00%,100%,0.00%,1.00,0.00%,0.00%,2.50%,0.00%,0.00%,0.00%,0.00%,2.50%,0.00%,,#N/A,#N/A,0,0,0,0.00%,100%,0.00%,0.00,0.00%,0.00%,0.00%,0.00%,0.00%,0.00%,0.00%,0.00%,0.00%,,#N/A,#N/A,0,0,0,0.00%,100%,0.00%,0.00,0.00%,0.00%,0.00%,0.00%,0.00%,0.00%,0.00%,0.00%,0.00%,START TECH DO NOT DELETE,#N/A,12,#N/A,#N/A,12,2,2,#N/A,12,#N/A,#N/A,12,#N/A,12,#N/A,12,#N/A,2,#N/A,#N/A,#N/A,#N/A,#N/A,#N/A,#N/A,#N/A,#N/A,#N/A,#N/A,#N/A,#N/A,#N/A,#N/A,#N/A,#N/A,#N/A,#N/A,END TECH DO NOT DELETE,#N/A,"109,789,178","109,789,178",1.00000000,2012,"17,403",1999,2012,2012,,,,,,,,,,https://www.njcleanenergy.com/files/file/23_.pdf,
New Jersey,0,34,NJ SB 1925,Renewables Portfolio Standard,7/23/2012,22.50%,2021,,,6.50%,,0,1,each electric power supplier or basic generation service provider,"BTM, Community Choice Aggregator, Co-Op, IOU, Municipal, Political Subdivision, Retail Power Marketer, State",Federal,0.00%,2020,2012,53,TRUE,#N/A,#N/A,FALSE,START RESULTS DO NOT DELETE,#N/A,#N/A,#N/A,#N/A,#N/A,#N/A,#N/A,#N/A,#N/A,#N/A,END RESULTS DO NOT DELETE,22.50%,0%,0.00%,0.00%,0.00%,0.00%,0.00%,23%,0%,23%,100.0%,7%,0.00%,0.00%,0.00%,0.00%,0.00%,29%,#N/A,#N/A,0.00%,RPS,2.00%,2021,0,0,1,0.00%,100%,0.00%,1.00,0.00%,0.00%,2.00%,0.00%,0.00%,0.00%,0.00%,2.00%,0.00%,RPS,18.00%,2021,0,1,1,0.00%,100%,0.00%,1.00,0.00%,0.00%,18.00%,0.00%,0.00%,0.00%,0.00%,18.00%,0.00%,RPS,2.50%,2021,0,0,1,0.00%,100%,0.00%,1.00,0.00%,0.00%,2.50%,0.00%,0.00%,0.00%,0.00%,2.50%,0.00%,,#N/A,#N/A,0,0,0,0.00%,100%,0.00%,0.00,0.00%,0.00%,0.00%,0.00%,0.00%,0.00%,0.00%,0.00%,0.00%,START TECH DO NOT DELETE,#N/A,2,#N/A,2,#N/A,3,23,2,12,#N/A,2,2,#N/A,2,#N/A,2,#N/A,3,#N/A,#N/A,#N/A,#N/A,#N/A,#N/A,#N/A,#N/A,#N/A,#N/A,#N/A,#N/A,#N/A,#N/A,#N/A,#N/A,#N/A,#N/A,#N/A,END TECH DO NOT DELETE,#N/A,"110,756,885","110,756,885",1.00000000,2018,"17,403",2012,2021,2021, ,,,,,,,,,https://www.njleg.state.nj.us/2012/Bills/AL12/24_.PDF,
New Jersey,0,34,NJ SB 3723,Renewables Portfolio Standard,5/23/2018,50.00%,2030,,,21%,,0,1,each electric power supplier or basic generation service provider,"BTM, Community Choice Aggregator, Co-Op, IOU, Municipal, Political Subdivision, Retail Power Marketer, State",Federal,0.00%,2020,2019,54,TRUE,#N/A,#N/A,FALSE,START RESULTS DO NOT DELETE,#N/A,#N/A,#N/A,#N/A,#N/A,#N/A,#N/A,#N/A,#N/A,#N/A,END RESULTS DO NOT DELETE,50.00%,0%,0.00%,0.00%,0.00%,0.00%,0.00%,50%,0%,50%,100.0%,21%,0.00%,0.00%,0.00%,0.00%,0.00%,42%,#N/A,#N/A,0.00%,RPS,2.21%,2030,0,0,1,0.00%,100%,0.00%,1.00,0.00%,0.00%,2.21%,0.00%,0.00%,0.00%,0.00%,2.21%,0.00%,RPS,45.29%,2030,0,1,1,0.00%,100%,0.00%,1.00,0.00%,0.00%,45.29%,0.00%,0.00%,0.00%,0.00%,45.29%,0.00%,RPS,2.50%,2030,0,0,1,0.00%,100%,0.00%,1.00,0.00%,0.00%,2.50%,0.00%,0.00%,0.00%,0.00%,2.50%,0.00%,,#N/A,#N/A,0,0,0,0.00%,100%,0.00%,0.00,0.00%,0.00%,0.00%,0.00%,0.00%,0.00%,0.00%,0.00%,0.00%,START TECH DO NOT DELETE,#N/A,2,#N/A,2,#N/A,3,23,2,12,#N/A,2,24,#N/A,2,#N/A,2,#N/A,3,#N/A,#N/A,#N/A,#N/A,#N/A,#N/A,#N/A,#N/A,#N/A,#N/A,#N/A,#N/A,#N/A,#N/A,#N/A,#N/A,#N/A,#N/A,#N/A,END TECH DO NOT DELETE,#N/A,"110,756,885","110,756,885",1.00000000,2018,"17,403",2018,2030,2030,,,,,,,,,,https://legiscan.com/NJ/bill/A3723/2018,Solar carve out decreases after peaking at 5.1% in  2023.  New Jersey contains a offshore wind carevout in MW terms which the BPU is mandated convert to a percentage of sales requirement (but has not as of july 2020).
New Mexico,0,35,NM Stat. § 62-15-34 et seq.,Renewable Portfolio Standard,5/31/2013,20.00%,2020,,,10%,,0,1,FOR RURAL ELECTRIC COOPERATIVES AND PUBLIC UTILITIES,IOU,"BTM, Community Choice Aggregator, Co-Op, Municipal, Political Subdivision, Retail Power Marketer, State, Federal",0.00%,2020,2012,55,TRUE,#N/A,#N/A,FALSE,START RESULTS DO NOT DELETE,#N/A,#N/A,#N/A,#N/A,#N/A,#N/A,#N/A,#N/A,#N/A,#N/A,END RESULTS DO NOT DELETE,14.01%,0%,0.00%,0.00%,0.00%,1.07000%,5.9899659%,13%,7%,20%,64.700170720%,6%,0.00%,0.00%,0.00%,0.00%,0.54%,50%,3x Solar operational before 2012,#N/A,1.07%,RPS,9.00%,2020,0,1,1,0.00%,100%,0.00%,1.00,0.00%,2.70%,6.30%,0.00%,0.00%,0.00%,2.70%,6.30%,0.00%,RPS,6.00%,2020,0,1,1,0.00%,100%,0.00%,1.00,0.00%,1.80%,4.20%,0.00%,0.00%,0.00%,1.80%,4.20%,0.00%,RPS,1.50%,2020,0,1,1,0.00%,100%,0.00%,1.00,0.00%,0.45%,1.05%,0.00%,0.00%,0.00%,0.45%,1.05%,0.00%,RPS,3.50%,2020,0,1,1,0.00%,100%,0.00%,1.00,0.00%,1.05%,2.45%,0.00%,0.00%,0.00%,1.05%,2.45%,0.00%,START TECH DO NOT DELETE,#N/A,34,#N/A,34,#N/A,34,34,#N/A,24,#N/A,#N/A,14,#N/A,34,#N/A,34,#N/A,#N/A,#N/A,#N/A,#N/A,34,#N/A,#N/A,#N/A,#N/A,#N/A,#N/A,#N/A,#N/A,#N/A,#N/A,#N/A,#N/A,#N/A,#N/A,#N/A,END TECH DO NOT DELETE,#N/A,"16,716,716","23,863,919",0.70050171,2018,"8,431",2013,2020,2020,2691887.39,#N/A,2691887.39,,35870965.18,8%,#N/A,8%,0%,http://164.64.110.239/nmac/parts/title17/17.009.0572.htm,
New Mexico,0,35,NM SB 43,Renewable Portfolio Standard,7/1/2004,10.00%,2011,,,5%,,0,1,FOR RURAL ELECTRIC COOPERATIVES AND PUBLIC UTILITIES,IOU,"BTM, Community Choice Aggregator, Co-Op, Municipal, Political Subdivision, Retail Power Marketer, State, Federal",0.00%,2020,2006,56,TRUE,#N/A,#N/A,FALSE,START RESULTS DO NOT DELETE,#N/A,#N/A,#N/A,#N/A,#N/A,#N/A,#N/A,#N/A,#N/A,#N/A,END RESULTS DO NOT DELETE,6.75%,0%,0.00%,0.00%,0.00%,0.00%,3.25%,7%,3%,10%,67.51960416055%,3%,0.00%,0.00%,0.00%,0.00%,0.00%,50%,#N/A,#N/A,0.00%,RPS,10.00%,2021,0,1,1,0.00%,100%,0.00%,1.00,0.00%,3.25%,6.75%,0.00%,0.00%,0.00%,3.25%,6.75%,0.00%,,#N/A,#N/A,0,0,0,0.00%,100%,0.00%,0.00,0.00%,0.00%,0.00%,0.00%,0.00%,0.00%,0.00%,0.00%,0.00%,,#N/A,#N/A,0,0,0,0.00%,100%,0.00%,0.00,0.00%,0.00%,0.00%,0.00%,0.00%,0.00%,0.00%,0.00%,0.00%,,#N/A,#N/A,0,0,0,0.00%,100%,0.00%,0.00,0.00%,0.00%,0.00%,0.00%,0.00%,0.00%,0.00%,0.00%,0.00%,START TECH DO NOT DELETE,#N/A,1,#N/A,1,#N/A,1,1,#N/A,1,#N/A,#N/A,1,#N/A,1,#N/A,#N/A,#N/A,#N/A,#N/A,#N/A,#N/A,#N/A,#N/A,#N/A,#N/A,#N/A,#N/A,#N/A,#N/A,#N/A,#N/A,#N/A,1,#N/A,#N/A,#N/A,#N/A,END TECH DO NOT DELETE,#N/A,"15,557,641","23,041,665",0.67519604,2011,"8,431",2004,2021,2011,652412,#N/A,652412,,32940361,2%,#N/A,2%,0%,https://www.nmlegis.gov/Sessions/04%20Regular/bills/senate/SB0043.pdf,
New Mexico,0,35,NM SB 489,Renewable Portfolio Standard,12/19/2020,80.00%,2040,100%,2045,20%,,0,1,FOR RURAL ELECTRIC COOPERATIVES AND PUBLIC UTILITIES,IOU,"BTM, Community Choice Aggregator, Co-Op, Municipal, Political Subdivision, Retail Power Marketer, State, Federal",0.00%,2020,2020,57,TRUE,#N/A,#N/A,FALSE,START RESULTS DO NOT DELETE,#N/A,#N/A,#N/A,#N/A,#N/A,#N/A,#N/A,#N/A,#N/A,#N/A,END RESULTS DO NOT DELETE,80.00%,20%,0.00%,0.00%,0.00%,0.00%,0.00%,100%,0%,100%,100.0%,20%,4.00%,0.00%,0.00%,0.00%,0.00%,20%,#N/A,#N/A,0.00%,RPS,80.00%,2040,1,0,1,0.00%,100%,0.00%,1.00,0.00%,0.00%,80.00%,0.00%,0.00%,0.00%,0.00%,80.00%,0.00%,CES,20.00%,2045,0,0,1,0.00%,100%,0.00%,1.00,0.00%,0.00%,20.00%,0.00%,0.00%,0.00%,0.00%,20.00%,0.00%,,#N/A,#N/A,0,0,0,0.00%,100%,0.00%,0.00,0.00%,0.00%,0.00%,0.00%,0.00%,0.00%,0.00%,0.00%,0.00%,,#N/A,#N/A,0,0,0,0.00%,100%,0.00%,0.00,0.00%,0.00%,0.00%,0.00%,0.00%,0.00%,0.00%,0.00%,0.00%,START TECH DO NOT DELETE,#N/A,1,#N/A,1,#N/A,1,1,#N/A,1,#N/A,#N/A,1,#N/A,1,#N/A,1,#N/A,#N/A,#N/A,#N/A,#N/A,#N/A,#N/A,#N/A,#N/A,#N/A,#N/A,#N/A,#N/A,#N/A,2,#N/A,#N/A,#N/A,#N/A,#N/A,#N/A,END TECH DO NOT DELETE,#N/A,"23,863,919","23,863,919",1.00000000,2018,"8,431",2020,2040,2045,7623967,7623967,7623967,7623967,32673682,23%,23%,23%,23%,https://www.nmlegis.gov/Sessions/19%20Regular/bills/senate/SB0489.pdf,Public Utilities Defined Here: https://law.justia.com/codes/new-mexico/2013/chapter-62/article-3/section-62-3-3/
New York,0,36,NY Public Service Comission Order Approving Renewable Portfolio Standard,Renewable Portfolio Standard,9/24/2004,25.00%,2013,,,19%,,0,1,"Load serving entities: one or more persons or corporations operating an agency or agencies for public service, and who or which is or are subject to the jurisdiction, supervision and regulations prescribed by or pursuant to provisions of this chapter other than article 14","BTM, Community Choice Aggregator, Co-Op, IOU, Municipal, Political Subdivision, Retail Power Marketer, State",Federal,4.00%,2020,2005,58,TRUE,#N/A,#N/A,FALSE,START RESULTS DO NOT DELETE,#N/A,#N/A,#N/A,#N/A,#N/A,#N/A,#N/A,#N/A,#N/A,#N/A,END RESULTS DO NOT DELETE,24.00%,0%,0.00%,1.00%,0.00%,0.00%,0.00%,24%,1%,25%,96.0%,18%,0.00%,0.00%,0.76%,0.00%,0.00%,76%,#N/A,#N/A,0.00%,RPS,25.00%,2013,1,0,0,25.00%,96%,0.00%,1.00,0.00%,0.00%,0.00%,0.00%,1.00%,0.00%,0.00%,24.00%,0.00%,,#N/A,#N/A,1,0,0,0.00%,96%,0.00%,0.00,0.00%,0.00%,0.00%,0.00%,0.00%,0.00%,0.00%,0.00%,0.00%,,#N/A,#N/A,0,0,0,0.00%,96%,0.00%,0.00,0.00%,0.00%,0.00%,0.00%,0.00%,0.00%,0.00%,0.00%,0.00%,,#N/A,#N/A,0,0,0,0.00%,96%,0.00%,0.00,0.00%,0.00%,0.00%,0.00%,0.00%,0.00%,0.00%,0.00%,0.00%,START TECH DO NOT DELETE,1,1,1,1,#N/A,1,1,#N/A,1,1,1,1,1,#N/A,#N/A,#N/A,#N/A,#N/A,#N/A,#N/A,#N/A,#N/A,#N/A,#N/A,#N/A,#N/A,#N/A,#N/A,#N/A,#N/A,#N/A,#N/A,#N/A,#N/A,#N/A,#N/A,#N/A,END TECH DO NOT DELETE,25592584,"217,042,025","217,042,025",1.00000000,2013,"41,124",2004,2013,2013,25901337,,25901337,25901337,137964794,19%,0%,19%,19%,http://documents.dps.ny.gov/public/Common/ViewDoc.aspx?DocRefId=%7BB1830060-A43F-426D-8948-F60E6B754734%7D,
New York,0,36,NY Public Service Comission Order Establishing New RPS Goal and Resolving Main Tier Issues,Renewable Portfolio Standard,1/8/2010,30.00%,2015,,,19%,,0,1,"Load serving entities: one or more persons or corporations operating an agency or agencies for public service, and who or which is or are subject to the jurisdiction, supervision and regulations prescribed by or pursuant to provisions of this chapter other than article 14","BTM, Community Choice Aggregator, Co-Op, IOU, Municipal, Political Subdivision, Retail Power Marketer, State",Federal,0.00%,2020,2011,59,TRUE,#N/A,#N/A,FALSE,START RESULTS DO NOT DELETE,#N/A,#N/A,#N/A,#N/A,#N/A,#N/A,#N/A,#N/A,#N/A,#N/A,END RESULTS DO NOT DELETE,30.00%,0%,0.00%,0.00%,0.00%,0.00%,0.00%,30%,0%,30%,100.0%,19%,0.00%,0.00%,0.00%,0.00%,0.00%,63%,#N/A,#N/A,0.00%,RPS,30.00%,2015,1,0,0,30.00%,100%,0.00%,1.00,0.00%,0.00%,0.00%,0.00%,0.00%,0.00%,0.00%,30.00%,0.00%,,#N/A,#N/A,1,0,0,0.00%,100%,0.00%,0.00,0.00%,0.00%,0.00%,0.00%,0.00%,0.00%,0.00%,0.00%,0.00%,,#N/A,#N/A,0,0,0,0.00%,100%,0.00%,0.00,0.00%,0.00%,0.00%,0.00%,0.00%,0.00%,0.00%,0.00%,0.00%,,#N/A,#N/A,0,0,0,0.00%,100%,0.00%,0.00,0.00%,0.00%,0.00%,0.00%,0.00%,0.00%,0.00%,0.00%,0.00%,START TECH DO NOT DELETE,1,1,1,1,#N/A,1,1,#N/A,1,1,1,1,1,#N/A,#N/A,#N/A,#N/A,#N/A,#N/A,#N/A,#N/A,#N/A,#N/A,#N/A,#N/A,#N/A,#N/A,#N/A,#N/A,#N/A,#N/A,#N/A,#N/A,#N/A,#N/A,#N/A,#N/A,END TECH DO NOT DELETE,25592584,"265,740,562","265,740,562",1.00000000,2015,"41,124",2010,2015,2015,30286245,#N/A,30286245,30286245,136961654,22%,#N/A,22%,22%,http://documents.dps.state.ny.us/public/Common/ViewDoc.aspx?DocRefId=%7B30CFE590-E7E1-473B-A648-450A39E80F48%7D,
New York,0,36,NY03R,Clean Energy Standard,8/1/2016,50.00%,2030,,,30.00%,,0,1,"Load serving entities: one or more persons or corporations operating an agency or agencies for public service, and who or which is or are subject to the jurisdiction, supervision and regulations prescribed by or pursuant to provisions of this chapter other than article 14","BTM, Community Choice Aggregator, Co-Op, IOU, Municipal, Political Subdivision, Retail Power Marketer, State",Federal,0.00%,2020,2016,60,TRUE,#N/A,#N/A,FALSE,START RESULTS DO NOT DELETE,#N/A,#N/A,#N/A,#N/A,#N/A,#N/A,#N/A,#N/A,#N/A,#N/A,END RESULTS DO NOT DELETE,50.00%,0%,0.00%,0.00%,0.00%,0.00%,0.00%,50%,0%,50%,100.0%,30%,0.00%,0.00%,0.00%,0.00%,0.00%,60%,#N/A,#N/A,0.00%,RPS,50.00%,2030,1,0,1,0.00%,100%,0.00%,1.00,0.00%,0.00%,50.00%,0.00%,0.00%,0.00%,0.00%,50.00%,0.00%,,#N/A,#N/A,0,0,0,0.00%,100%,0.00%,0.00,0.00%,0.00%,0.00%,0.00%,0.00%,0.00%,0.00%,0.00%,0.00%,,#N/A,#N/A,0,0,0,0.00%,100%,0.00%,0.00,0.00%,0.00%,0.00%,0.00%,0.00%,0.00%,0.00%,0.00%,0.00%,,#N/A,#N/A,0,0,0,0.00%,100%,0.00%,0.00,0.00%,0.00%,0.00%,0.00%,0.00%,0.00%,0.00%,0.00%,0.00%,START TECH DO NOT DELETE,#N/A,#N/A,#N/A,1,#N/A,1,1,1,1,#N/A,1,1,#N/A,1,#N/A,#N/A,#N/A,#N/A,#N/A,#N/A,#N/A,#N/A,#N/A,#N/A,#N/A,#N/A,#N/A,#N/A,#N/A,#N/A,#N/A,#N/A,#N/A,#N/A,#N/A,#N/A,#N/A,END TECH DO NOT DELETE,#N/A,"219,701,381","219,701,381",1.00000000,2018,"41,124",2016,2030,2030,33211534,#N/A,33211534,33211534,134417107,25%,#N/A,25%,25%,http://documents.dps.ny.gov/public/Common/ViewDoc.aspx?DocRefId={44C5D5B8-14C3-4F32-8399-F5487D6D8FE8},
New York,0,36,NY SB 06599,Clean Energy Standard,8/4/2019,70.00%,2030,100%,2040,30%,,0,1,"Load serving entities: one or more persons or corporations operating an agency or agencies for public service, and who or which is or are subject to the jurisdiction, supervision and regulations prescribed by or pursuant to provisions of this chapter other than article 14","BTM, Community Choice Aggregator, Co-Op, IOU, Municipal, Political Subdivision, Retail Power Marketer, State",Federal,0.00%,2020,2020,61,TRUE,#N/A,#N/A,FALSE,START RESULTS DO NOT DELETE,#N/A,#N/A,#N/A,#N/A,#N/A,#N/A,#N/A,#N/A,#N/A,#N/A,END RESULTS DO NOT DELETE,70.00%,30%,0.00%,0.00%,0.00%,0.00%,0.00%,100%,0%,100%,100.0%,30%,9.00%,0.00%,0.00%,0.00%,0.00%,30%,#N/A,#N/A,0.00%,RPS,70.00%,2030,0,0,1,0.00%,100%,0.00%,1.00,0.00%,0.00%,70.00%,0.00%,0.00%,0.00%,0.00%,70.00%,0.00%,CES,30.00%,2040,0,0,1,0.00%,100%,0.00%,1.00,0.00%,0.00%,30.00%,0.00%,0.00%,0.00%,0.00%,30.00%,0.00%,,#N/A,#N/A,0,0,0,0.00%,100%,0.00%,0.00,0.00%,0.00%,0.00%,0.00%,0.00%,0.00%,0.00%,0.00%,0.00%,,#N/A,#N/A,0,0,0,0.00%,100%,0.00%,0.00,0.00%,0.00%,0.00%,0.00%,0.00%,0.00%,0.00%,0.00%,0.00%,START TECH DO NOT DELETE,#N/A,#N/A,#N/A,1,#N/A,1,12,2,1,#N/A,1,1,#N/A,1,2,#N/A,#N/A,#N/A,#N/A,#N/A,#N/A,#N/A,#N/A,#N/A,#N/A,#N/A,#N/A,#N/A,#N/A,#N/A,#N/A,#N/A,#N/A,#N/A,#N/A,#N/A,#N/A,END TECH DO NOT DELETE,#N/A,"219,701,381","219,701,381",1.00000000,2018,"41,124",2019,2030,2040,36067540,78986551,36067540,78986551,132520501,27%,60%,27%,60%,https://nyassembly.gov/leg/?default_fld=&leg_video=&bn=S06599&term=2019&Summary=Y&Actions=Y&Text=Y,
North Carolina,0,37,NC SB 3,Renewable Energy and Energy Efficiency Portfolio Standard,1/1/2008,11.68%,2021,,,0.00%,,1,1," ""Electric power supplier"" means a public utility, an electric membership corporation, or a municipality that sells electric power to retail electric power customers in the State.","BTM, Community Choice Aggregator, Co-Op, IOU, Municipal, Political Subdivision, Retail Power Marketer, State",Federal,0.00%,2020,2009,62,TRUE,#N/A,#N/A,FALSE,START RESULTS DO NOT DELETE,#N/A,#N/A,#N/A,#N/A,#N/A,#N/A,#N/A,#N/A,#N/A,#N/A,END RESULTS DO NOT DELETE,11.68%,0.000%,0.00%,0.00%,0.00%,0.00%,0.00%,12%,0%,12%,100.0%,0%,0.00%,0.00%,0.00%,0.00%,0.00%,0%,#N/A,#N/A,0.00%,RPS,5.07%,2021,0,1,1,0.00%,100%,0.00%,1.00,0.00%,0.00%,5.07%,0.00%,0.00%,0.00%,0.00%,5.07%,0.00%,RPS,3.05%,2021,0,0,1,0.00%,100%,0.00%,1.00,0.00%,0.00%,3.05%,0.00%,0.00%,0.00%,0.00%,3.05%,0.00%,RPS,3.56%,2021,0,0,1,0.00%,100%,0.00%,0.00,0.00%,0.00%,3.56%,0.00%,0.00%,0.00%,0.00%,3.56%,0.00%,,#N/A,#N/A,0,0,0,0.00%,100%,0.00%,0.00,0.00%,0.00%,0.00%,0.00%,0.00%,0.00%,0.00%,0.00%,0.00%,START TECH DO NOT DELETE,#N/A,13,#N/A,13,#N/A,3,3,3,13,#N/A,13,13,#N/A,#N/A,#N/A,13,13,#N/A,#N/A,13,#N/A,#N/A,#N/A,#N/A,#N/A,#N/A,#N/A,#N/A,#N/A,#N/A,#N/A,#N/A,#N/A,#N/A,#N/A,#N/A,#N/A,END TECH DO NOT DELETE,#N/A,"137,017,975","137,017,975",1.00,2018,"34,178",2008,2021,2021,,,,,,,,,,https://www.ncleg.net/EnactedLegislation/Statutes/HTML/BySection/Chapter_62/GS_62-133.8.html,"3x credit for the first 20MW of biomass located in ""cleanfields renewable energy demonstration park"". Bizzare clause that results in 40 MW of double counting. "
North Dakota,0,38,ND HB 1506,Renewable and Recycled Energy Objective,8/24/2007,10.00%,2015,,,0%,,0,1,retail provider of electricity,"IOU, Municipal, Co-Op","BTM, Community Choice Aggregator, Political Subdivision, Retail Power Marketer, State, Federal",0.00%,2020,2008,63,TRUE,#N/A,#N/A,FALSE,START RESULTS DO NOT DELETE,#N/A,#N/A,#N/A,#N/A,#N/A,#N/A,#N/A,#N/A,#N/A,#N/A,END RESULTS DO NOT DELETE,9.89%,0%,0.00%,0.00%,0.00%,0.00%,0.11%,10%,0%,10%,98.9%,0%,0.00%,0.00%,0.00%,0.00%,0.00%,0%,#N/A,#N/A,0.00%,RPS,10.00%,2015,1,0,0,10.00%,100%,0.00%,1.00,0.00%,0.00%,0.00%,0.00%,0.00%,0.00%,0.11%,9.89%,0.00%,,#N/A,#N/A,0,0,0,0.00%,100%,0.00%,0.00,0.00%,0.00%,0.00%,0.00%,0.00%,0.00%,0.00%,0.00%,0.00%,,#N/A,#N/A,0,0,0,0.00%,100%,0.00%,0.00,0.00%,0.00%,0.00%,0.00%,0.00%,0.00%,0.00%,0.00%,0.00%,,#N/A,#N/A,0,0,0,0.00%,100%,0.00%,0.00,0.00%,0.00%,0.00%,0.00%,0.00%,0.00%,0.00%,0.00%,0.00%,START TECH DO NOT DELETE,#N/A,1,#N/A,1,#N/A,#N/A,1,1,1,#N/A,#N/A,1,#N/A,1,#N/A,#N/A,#N/A,#N/A,#N/A,#N/A,#N/A,#N/A,#N/A,#N/A,#N/A,#N/A,#N/A,#N/A,#N/A,#N/A,#N/A,#N/A,#N/A,#N/A,#N/A,#N/A,#N/A,END TECH DO NOT DELETE,#N/A,"17,666,207","17,863,186",0.98897291,2015,"8,381",2007,2015,2015,,,,,,,,,,https://www.legis.nd.gov/assembly/60-2007/bill-text/HBIO0300.pdf,No hydro before 2007
Ohio,0,39,OH SB 221,Alternative Energy Portfolio Standard,7/31/2008,12.50%,2025,,,0.25%,,0,1,means an electric light company that has a certified territory and is engaged on a for-profit basis either in the business of supplying a noncompetitive retail electric service in this state or in the businesses of supplying both a noncompetitive and a competitive retail electric service in this state. ,"BTM, Community Choice Aggregator, Co-Op, IOU, Municipal, Political Subdivision, Retail Power Marketer, State",Federal,0.00%,2020,2009,64,TRUE,#N/A,#N/A,FALSE,START RESULTS DO NOT DELETE,#N/A,#N/A,#N/A,#N/A,#N/A,#N/A,#N/A,#N/A,#N/A,#N/A,END RESULTS DO NOT DELETE,0.50%,12%,0.00%,0.00%,0.00%,0.00%,0.00%,13%,0%,13%,100.0%,0%,0.24%,0.00%,0.00%,0.00%,0.00%,2%,#N/A,#N/A,0.00%,RPS,0.50%,2025,1,1,1,0.00%,100%,0.00%,1.00,0.00%,0.00%,0.50%,0.00%,0.00%,0.00%,0.00%,0.50%,0.00%,CES,12.00%,2025,1,0,1,0.00%,100%,0.00%,1.00,0.00%,0.00%,12.00%,0.00%,0.00%,0.00%,0.00%,12.00%,0.00%,,#N/A,#N/A,0,0,0,0.00%,100%,0.00%,0.00,0.00%,0.00%,0.00%,0.00%,0.00%,0.00%,0.00%,0.00%,0.00%,,#N/A,#N/A,0,0,0,0.00%,100%,0.00%,0.00,0.00%,0.00%,0.00%,0.00%,0.00%,0.00%,0.00%,0.00%,0.00%,START TECH DO NOT DELETE,2,2,2,#N/A,2,#N/A,2,2,12,#N/A,#N/A,2,#N/A,2,#N/A,2,#N/A,#N/A,#N/A,2,#N/A,#N/A,#N/A,#N/A,#N/A,#N/A,#N/A,#N/A,#N/A,#N/A,#N/A,#N/A,#N/A,#N/A,#N/A,#N/A,#N/A,END TECH DO NOT DELETE,406667,"249,231,665","249,231,665",1.00000000,2018,"29,142",2008,2025,2025,,,,,,,,,,http://archives.legislature.state.oh.us/bills.cfm?ID=127_SB_221,
Ohio,0,39,OH HB 6,Alternative Energy Portfolio Standard,10/22/2019,8.50%,2026,,,5.50%,,0,1,means an electric light company that has a certified territory and is engaged on a for-profit basis either in the business of supplying a noncompetitive retail electric service in this state or in the businesses of supplying both a noncompetitive and a competitive retail electric service in this state. ,"BTM, Community Choice Aggregator, Co-Op, IOU, Municipal, Political Subdivision, Retail Power Marketer, State",Federal,0.00%,2020,2019,65,TRUE,#N/A,#N/A,FALSE,START RESULTS DO NOT DELETE,#N/A,#N/A,#N/A,#N/A,#N/A,#N/A,#N/A,#N/A,#N/A,#N/A,END RESULTS DO NOT DELETE,0.00%,9%,0.00%,0.00%,0.00%,0.00%,0.00%,9%,0%,9%,100.0%,6%,5.50%,0.00%,0.00%,0.00%,0.00%,65%,#N/A,#N/A,0.00%,CES,8.50%,2026,1,0,1,0.00%,100%,0.00%,1.00,0.00%,0.00%,8.50%,0.00%,0.00%,0.00%,0.00%,8.50%,0.00%,,#N/A,#N/A,1,0,0,0.00%,100%,0.00%,0.00,0.00%,0.00%,0.00%,0.00%,0.00%,0.00%,0.00%,0.00%,0.00%,,#N/A,#N/A,0,0,0,0.00%,100%,0.00%,0.00,0.00%,0.00%,0.00%,0.00%,0.00%,0.00%,0.00%,0.00%,0.00%,,#N/A,#N/A,0,0,0,0.00%,100%,0.00%,0.00,0.00%,0.00%,0.00%,0.00%,0.00%,0.00%,0.00%,0.00%,0.00%,START TECH DO NOT DELETE,1,1,1,#N/A,1,#N/A,1,1,1,#N/A,#N/A,1,#N/A,1,#N/A,1,#N/A,#N/A,#N/A,1,#N/A,#N/A,#N/A,#N/A,#N/A,#N/A,#N/A,#N/A,#N/A,#N/A,#N/A,#N/A,#N/A,#N/A,#N/A,#N/A,#N/A,END TECH DO NOT DELETE,406667,"249,231,665","249,231,665",1.00000000,2018,"29,142",2019,2026,2026,,,,,,,,,,https://www.legislature.ohio.gov/legislation/legislation-summary?id=GA133-HB-6,
Oregon,0,41,OR SB 1547,Renewable Portfolio Standard,3/8/2016,41.86%,2040,,,10.11%,,1,1,an electric company or consumer-owned utility that is engaged in the business of distributing electricity to retail electricity consumers in this state.,"IOU, Municipal, Co-Op","BTM, Community Choice Aggregator,  Political Subdivision, Retail Power Marketer, State, Federal",0.00%,2020,2017,66,TRUE,#N/A,#N/A,FALSE,START RESULTS DO NOT DELETE,#N/A,#N/A,#N/A,#N/A,#N/A,#N/A,#N/A,#N/A,#N/A,#N/A,END RESULTS DO NOT DELETE,39.88%,0.000%,0.00%,0.00%,0.00%,0.08%,1.98%,40%,2%,42%,95.1%,10%,0.00%,0.00%,0.00%,0.00%,0.02%,24%,2x for PV up to 5MW operated before 2016,#N/A,0.08%,RPS,41.86%,2040,0,1,1,0.00%,100%,0.00%,1.00,0.00%,1.98%,39.88%,0.00%,0.00%,0.00%,1.98%,39.88%,0.00%,,#N/A,#N/A,0,0,0,0.00%,100%,0.00%,0.00,0.00%,0.00%,0.00%,0.00%,0.00%,0.00%,0.00%,0.00%,0.00%,,#N/A,#N/A,0,0,0,0.00%,100%,0.00%,0.00,0.00%,0.00%,0.00%,0.00%,0.00%,0.00%,0.00%,0.00%,0.00%,,#N/A,#N/A,0,0,0,0.00%,100%,0.00%,0.00,0.00%,0.00%,0.00%,0.00%,0.00%,0.00%,0.00%,0.00%,0.00%,START TECH DO NOT DELETE,1,1,#N/A,#N/A,#N/A,1,1,#N/A,1,#N/A,1,1,#N/A,1,#N/A,1,#N/A,#N/A,#N/A,#N/A,#N/A,1,#N/A,#N/A,#N/A,#N/A,#N/A,#N/A,#N/A,#N/A,#N/A,#N/A,#N/A,#N/A,#N/A,#N/A,#N/A,END TECH DO NOT DELETE,#N/A,"49,177,321.00","51,620,600",0.95,2018,"12,526",2016,2040,2040,,,,,,,,,,https://olis.leg.state.or.us/liz/2016R1/Downloads/MeasureDocument/SB1547/Enrolled,Contains a carve out for distributed generation capacity (8%) which has not been enforced yet due to lack of a monitoring system.
Oregon,0,41,OR SB 838,Renewable Portfolio Standard,6/6/2007,25.00%,2025,,,3%,,0,1,an electric company or consumer-owned utility that is engaged in the business of distributing electricity to retail electricity consumers in this state.,"BTM, Community Choice Aggregator, Co-Op, IOU, Municipal, Political Subdivision, Retail Power Marketer, State",Federal,0.00%,2020,2007,67,TRUE,#N/A,#N/A,FALSE,START RESULTS DO NOT DELETE,#N/A,#N/A,#N/A,#N/A,#N/A,#N/A,#N/A,#N/A,#N/A,#N/A,END RESULTS DO NOT DELETE,24.98%,0%,0.00%,0.00%,0.00%,0.00%,0.02%,25%,0%,25%,99.9%,3%,0.00%,0.00%,0.00%,0.00%,0.00%,12%,#N/A,#N/A,0.00%,RPS,25.00%,2025,0,0,1,0.00%,100%,0.00%,1.00,0.00%,0.02%,24.98%,0.00%,0.00%,0.00%,0.02%,24.98%,0.00%,,#N/A,#N/A,0,0,0,0.00%,100%,0.00%,0.00,0.00%,0.00%,0.00%,0.00%,0.00%,0.00%,0.00%,0.00%,0.00%,,#N/A,#N/A,0,0,0,0.00%,100%,0.00%,0.00,0.00%,0.00%,0.00%,0.00%,0.00%,0.00%,0.00%,0.00%,0.00%,,#N/A,#N/A,0,0,0,0.00%,100%,0.00%,0.00,0.00%,0.00%,0.00%,0.00%,0.00%,0.00%,0.00%,0.00%,0.00%,START TECH DO NOT DELETE,1,1,#N/A,#N/A,#N/A,1,1,#N/A,1,#N/A,1,1,#N/A,1,#N/A,1,#N/A,#N/A,#N/A,#N/A,#N/A,1,#N/A,#N/A,#N/A,#N/A,#N/A,#N/A,#N/A,#N/A,#N/A,#N/A,#N/A,#N/A,#N/A,#N/A,#N/A,END TECH DO NOT DELETE,#N/A,"51,586,675","51,620,600",0.99934280,2018,"16,590",2007,2025,2025,,,,,,,,,,https://olis.leg.state.or.us/liz/2007R1/Downloads/MeasureDocument/SB838/Enrolled,
Pennsylvania,0,42,PA SB 1030,Alternative Energy Portfolio Standard,2/28/2005,18.00%,2021,,,2.20%,,0,1," A person or corporation, including municipal corporations which choose to provide service outside their municipal limits except to the extent provided prior to the effective date of this chapter, brokers and marketers, aggregators or any other entities, that sells to end-use customers electricity or related services utilizing the jurisdictional transmission or distribution facilities of an electric distribution company or that purchases, brokers, arranges or markets electricity or related services for sale to end-use customers utilizing the jurisdictional transmission and distribution facilities of an electric distribution company.","BTM, Community Choice Aggregator, Co-Op, IOU, Municipal, Political Subdivision, Retail Power Marketer, State",Federal,0.00%,2020,2005,68,TRUE,#N/A,#N/A,FALSE,START RESULTS DO NOT DELETE,#N/A,#N/A,#N/A,#N/A,#N/A,#N/A,#N/A,#N/A,#N/A,#N/A,END RESULTS DO NOT DELETE,0.00%,0%,18.00%,0.00%,0.00%,0.00%,0.00%,0%,18%,18%,0.0%,0%,0.00%,2.20%,0.00%,0.00%,0.00%,12%,#N/A,#N/A,0.00%,CO2,8.00%,2021,0,1,1,0.00%,100%,0.00%,1.00,0.00%,0.00%,0.00%,8.00%,0.00%,0.00%,0.00%,0.00%,8.00%,CO2,10.00%,2021,0,0,1,0.00%,100%,0.00%,1.00,0.00%,0.00%,0.00%,10.00%,0.00%,0.00%,0.00%,0.00%,10.00%,,#N/A,#N/A,0,0,0,0.00%,100%,0.00%,0.00,0.00%,0.00%,0.00%,0.00%,0.00%,0.00%,0.00%,0.00%,0.00%,,#N/A,#N/A,0,0,0,0.00%,100%,0.00%,0.00,0.00%,0.00%,0.00%,0.00%,0.00%,0.00%,0.00%,0.00%,0.00%,START TECH DO NOT DELETE,1,12,#N/A,#N/A,1,2,2,1,1,#N/A,#N/A,1,#N/A,1,#N/A,#N/A,2,#N/A,#N/A,#N/A,2,#N/A,1,#N/A,#N/A,2,#N/A,#N/A,2,#N/A,#N/A,#N/A,#N/A,#N/A,#N/A,#N/A,#N/A,END TECH DO NOT DELETE,#N/A,"244,315,969","244,315,969",1.00000000,2018,"48,558",2005,2021,2021,,,,,,,,,,https://www.legis.state.pa.us/cfdocs/billinfo/billinfo.cfm?syear=2003&sind=0&body=S&type=B&BN=1030,
